{
  "$schema":"https://json-schema.org/draft/2020-12/schema","$id":"https://coh.invalid/contracts/pysigma-helper/v1/compile-response.schema.json","title":"COH pySigma compile response","type":"object","additionalProperties":false,
  "required":["schema_version","contract_version","request_id","request_digest","outcome","reason_codes","diagnostics","target","sigma_digest","mapping_digest","target_schema_digest","native_query","native_query_digest","helper_identity","provenance_digest","response_digest"],
  "properties":{"schema_version":{"const":"coh.pysigma-helper-response/v1"},"contract_version":{"const":"1.0.0"},"request_id":{"$ref":"#/$defs/uuid"},"request_digest":{"$ref":"#/$defs/digest"},"outcome":{"enum":["compiled_untrusted","needs_mapping","unsupported","denied"]},"reason_codes":{"type":"array","maxItems":32,"uniqueItems":true,"items":{"$ref":"#/$defs/reason"}},"diagnostics":{"type":"array","maxItems":32,"items":{"$ref":"#/$defs/diagnostic"}},"target":{"$ref":"#/$defs/target"},"sigma_digest":{"$ref":"#/$defs/digest"},"mapping_digest":{"$ref":"#/$defs/digest"},"target_schema_digest":{"$ref":"#/$defs/digest"},"native_query":{"type":"string","maxLength":262144},"native_query_digest":{"type":"string","maxLength":71},"helper_identity":{"$ref":"#/$defs/identity"},"provenance_digest":{"$ref":"#/$defs/digest"},"response_digest":{"$ref":"#/$defs/digest"}},
  "$defs":{"uuid":{"type":"string","pattern":"^[0-9a-f]{8}-[0-9a-f]{4}-7[0-9a-f]{3}-[89ab][0-9a-f]{3}-[0-9a-f]{12}$"},"digest":{"type":"string","pattern":"^sha256:[0-9a-f]{64}$"},"reason":{"type":"string","pattern":"^[a-z][a-z0-9_]{0,63}$"},"token":{"type":"string","pattern":"^[a-z][a-z0-9_.-]{0,127}$"},"diagnostic":{"type":"object","additionalProperties":false,"required":["code","severity","class","location"],"properties":{"code":{"type":"string","pattern":"^[A-Z][A-Z0-9]{1,15}$"},"severity":{"const":"error"},"class":{"$ref":"#/$defs/reason"},"location":{"$ref":"#/$defs/token"}}},"target":{"type":"object","additionalProperties":false,"required":["target","native_language","backend_package","backend_version","backend_commit","backend_class","output_format"],"properties":{"target":{"enum":["elastic","security-onion","sentinel","splunk"]},"native_language":{"enum":["esql","kql","security-onion-oql","spl"]},"backend_package":{"type":"string","minLength":1,"maxLength":64},"backend_version":{"type":"string","minLength":1,"maxLength":16},"backend_commit":{"type":"string","minLength":1,"maxLength":40},"backend_class":{"type":"string","minLength":1,"maxLength":64},"output_format":{"type":"string","minLength":1,"maxLength":16}}},"identity":{"type":"object","additionalProperties":false,"required":["name","version","rid","artifact_digest","package_closure_digest","runtime_digest","backend_matrix_digest","profile_digest"],"properties":{"name":{"const":"coh-pysigma-helper"},"version":{"const":"pysigma-1.5.0-coh-1.0.0"},"rid":{"enum":["linux-arm64","linux-x64","osx-arm64"]},"artifact_digest":{"$ref":"#/$defs/digest"},"package_closure_digest":{"$ref":"#/$defs/digest"},"runtime_digest":{"$ref":"#/$defs/digest"},"backend_matrix_digest":{"$ref":"#/$defs/digest"},"profile_digest":{"$ref":"#/$defs/digest"}}}}
}
