{
  "schema_version": "coh.pysigma-helper-response/v1",
  "contract_version": "1.0.0",
  "request_id": "018f0000-0000-7000-8000-000000000002",
  "request_digest": "sha256:90c7530b5c8518e13396433dffff4dbb73afbe76c729693970caae11d406f25a",
  "outcome": "needs_mapping",
  "reason_codes": ["mapping_missing"],
  "diagnostics": [{"code":"MAP001","severity":"error","class":"mapping_missing","location":"detection.selection"}],
  "target": {
    "target": "elastic",
    "native_language": "esql",
    "backend_package": "pysigma-backend-elasticsearch",
    "backend_version": "2.1.0",
    "backend_commit": "5bf3529d1450e46b6a937ad29ecf0e122fbadf9d",
    "backend_class": "ESQLBackend",
    "output_format": "default"
  },
  "sigma_digest": "sha256:053b45f48c696d561e5f9d4c9ada82869b4e06e14792f0031bd8fbfa08adea64",
  "mapping_digest": "sha256:cc791f2da3d3f476797218efe7954a0bfbaf28239ba9ba1c3f4205838206fb39",
  "target_schema_digest": "sha256:2222222222222222222222222222222222222222222222222222222222222222",
  "native_query": "",
  "native_query_digest": "",
  "helper_identity": {
    "name": "coh-pysigma-helper",
    "version": "pysigma-1.5.0-coh-1.0.0",
    "rid": "osx-arm64",
    "artifact_digest": "sha256:aaaaaaaaaaaaaaaaaaaaaaaaaaaaaaaaaaaaaaaaaaaaaaaaaaaaaaaaaaaaaaaa",
    "package_closure_digest": "sha256:bbbbbbbbbbbbbbbbbbbbbbbbbbbbbbbbbbbbbbbbbbbbbbbbbbbbbbbbbbbbbbbb",
    "runtime_digest": "sha256:cccccccccccccccccccccccccccccccccccccccccccccccccccccccccccccccc",
    "backend_matrix_digest": "sha256:dddddddddddddddddddddddddddddddddddddddddddddddddddddddddddddddd",
    "profile_digest": "sha256:eeeeeeeeeeeeeeeeeeeeeeeeeeeeeeeeeeeeeeeeeeeeeeeeeeeeeeeeeeeeeeee"
  },
  "provenance_digest": "sha256:5555555555555555555555555555555555555555555555555555555555555555",
  "response_digest": "sha256:3e50cd75bf4b5b038b1fd46432dd1a510639bd3babade58f69772b971b5012b8"
}
